category,subcategory,name,current_price,raw_price,discount,likes_count,is_new,brand,brand_url,variation_0_color,variation_1_color,variation_0_thumbnail,variation_0_image,variation_1_thumbnail,variation_1_image,image_url,id,description
shoes,Sandals and mules,Relaxed beach slippers,1746.3999999999999,3348.0,48,46,False,,,brown,Blue,https://imgaz1.chiccdn.com/thumb/list_grid/oaupload/newchic/images/B9/42/b9538a7e-c64c-4466-8c91-ce288aee5f58.JPG,https://imgaz1.chiccdn.com/thumb/view/oaupload/newchic/images/B9/42/b9538a7e-c64c-4466-8c91-ce288aee5f58.JPG,https://imgaz1.chiccdn.com/thumb/list_grid/oaupload/newchic/images/33/32/d98824bd-2793-450c-ac22-2fd2fca0317f.JPG,https://imgaz1.chiccdn.com/thumb/view/oaupload/newchic/images/33/32/d98824bd-2793-450c-ac22-2fd2fca0317f.JPG,https://imgaz1.chiccdn.com/thumb/view/oaupload/newchic/images/33/32/d98824bd-2793-450c-ac22-2fd2fca0317f.JPG,1700023,"Slip into the ultimate comfort and style with our Relaxed Beach Slippers. Crafted from premium materials, these slippers offer a plush, cushioned feel that will keep your feet happy all day long. With their laid-back design and versatile colors, they're the perfect choice for a day at the beach, a stroll through the park, or simply lounging at home. Experience the unmatched comfort and effortless style of our Relaxed Beach Slippers today."
shoes,Sneakers and sneakers,Leopard colorblock printed shoes printed,2118.4,4156.8,49,23,False,,,Blue,Nope,https://imgaz1.chiccdn.com/thumb/list_grid/oaupload/newchic/images/AC/62/c3ed6494-c9eb-4798-a937-e1d0582b422d.jpg,https://imgaz1.chiccdn.com/thumb/view/oaupload/newchic/images/AC/62/c3ed6494-c9eb-4798-a937-e1d0582b422d.jpg,,,https://imgaz1.chiccdn.com/thumb/view/oaupload/newchic/images/57/F2/327b4b54-a03c-414d-ba50-fa0cdde2385b.jpg,1707371,"Step out in style and confidence with our eye-catching leopard colorblock printed shoes. Crafted with premium materials, these shoes boast a vibrant and unique design that will make a statement wherever you go. The bold leopard print and contrasting color blocks add a touch of wild sophistication to your everyday look. Experience the perfect blend of comfort and style as you conquer the day, one step at a time. Available in [color options], these shoes are the perfect finishing touch to any outfit."
shoes,Moccasins,Menico non -slip leather shoes for men,2964.0,6586.4,55,10,False,,,Black,Blue,https://imgaz1.chiccdn.com/thumb/list_grid/oaupload/newchic/images/2F/D4/be47cb6f-fc60-4975-9dca-070a0af43dfb.jpg,https://imgaz1.chiccdn.com/thumb/view/oaupload/newchic/images/2F/D4/be47cb6f-fc60-4975-9dca-070a0af43dfb.jpg,https://imgaz1.chiccdn.com/thumb/list_grid/oaupload/newchic/images/F5/9A/aedefc55-b853-4389-8852-48615a9c3187.jpg,https://imgaz1.chiccdn.com/thumb/view/oaupload/newchic/images/F5/9A/aedefc55-b853-4389-8852-48615a9c3187.jpg,https://imgaz1.chiccdn.com/thumb/view/oaupload/newchic/images/7A/38/3256b9c0-b056-4d3a-828e-8d8e11671a5d.jpg,1685583,"Presenting the Menico non-slip leather shoes, the epitome of style and functionality for the modern man. Crafted from genuine leather and adorned with intricate stitching, these shoes exude a timeless elegance that elevates any outfit. The non-slip soles provide superior traction, ensuring your every step is confident and secure, whether you're navigating city streets or traversing rugged terrain. Experience the fusion of fashion and performance with the Menico leather shoes."
shoes,Sandals and mules,Flower Decor relaxed sandals,1759.1999999999998,3428.0,49,15,False,,,Black,money,https://imgaz1.chiccdn.com/thumb/list_grid/oaupload/newchic/images/26/AA/84d1e29d-520b-4242-809d-05d576296ec5.jpeg,https://imgaz1.chiccdn.com/thumb/view/oaupload/newchic/images/26/AA/84d1e29d-520b-4242-809d-05d576296ec5.jpeg,https://imgaz1.chiccdn.com/thumb/list_grid/oaupload/newchic/images/E9/E9/5266b91a-41f0-4539-a7e4-33892606eb94.jpeg,https://imgaz1.chiccdn.com/thumb/view/oaupload/newchic/images/E9/E9/5266b91a-41f0-4539-a7e4-33892606eb94.jpeg,https://imgaz1.chiccdn.com/thumb/view/oaupload/newchic/images/AF/C3/603d4268-02a1-43c8-85fd-48645bac2106.jpeg,1678660,"Embrace the beauty of nature with our Flower Decor relaxed sandals. Crafted with a soft, contoured footbed, these sandals provide ultimate comfort for your feet, while the vibrant floral design adds a touch of springtime charm to your everyday look. Perfect for leisurely walks, shopping trips, and casual outings, these sandals will elevate your style while keeping you feeling relaxed and comfortable all day long."
shoes,Sandals and mules,Leather wedge sandals,3999.2000000000003,12176.0,67,70,False,Socofy,https://fr.newchic.com/socofy-brand-298.html,Purple,Green,https://imgaz1.chiccdn.com/thumb/list_grid/oaupload/newchic/images/90/BB/61c5dea2-c8a4-4b23-9928-2526ab950bd8.JPG,https://imgaz1.chiccdn.com/thumb/view/oaupload/newchic/images/90/BB/61c5dea2-c8a4-4b23-9928-2526ab950bd8.JPG,https://imgaz1.chiccdn.com/thumb/list_grid/oaupload/newchic/images/CF/F3/98a5d988-7e89-470e-8ced-ec84b8513897.JPG,https://imgaz1.chiccdn.com/thumb/view/oaupload/newchic/images/CF/F3/98a5d988-7e89-470e-8ced-ec84b8513897.JPG,https://imgaz1.chiccdn.com/thumb/view/oaupload/newchic/images/26/EC/fd716da0-4fc8-4672-9f9f-a2b55fb3701a.JPG,1668635,"Walk in style and comfort with our genuine leather wedge sandals. Expertly crafted with premium materials, these sandals are designed to provide exceptional support and timeless appeal. Step confidently on the soft leather footbed as the durable wedge heel offers perfect balance and height. Available in a variety of colors, these sandals are the perfect complement to any outfit, elevating your look effortlessly. Whether you're running errands or strolling through the city, our leather wedge sandals are your perfect everyday companion."
shoes,Moccasins,Leather outdoor relaxed shoes for men,5164.8,9268.8,44,23,False,,,Black,Brown,https://imgaz1.chiccdn.com/thumb/list_grid/oaupload/newchic/images/30/F7/d071c497-c889-481b-a2f8-66a0d6a73c69.jpg,https://imgaz1.chiccdn.com/thumb/view/oaupload/newchic/images/30/F7/d071c497-c889-481b-a2f8-66a0d6a73c69.jpg,https://imgaz1.chiccdn.com/thumb/list_grid/oaupload/newchic/images/1A/79/4c6aea15-8b4a-4a8f-a406-2eea7ae84ec0.jpg,https://imgaz1.chiccdn.com/thumb/view/oaupload/newchic/images/1A/79/4c6aea15-8b4a-4a8f-a406-2eea7ae84ec0.jpg,https://imgaz1.chiccdn.com/thumb/view/oaupload/newchic/images/D0/FC/e7d8f6a0-2962-4fc5-b857-2424752e3a3c.jpg,1662632,"Introducing our handcrafted leather outdoor relaxed shoes for men. These shoes combine style and comfort like never before. Crafted with premium leather, breathable mesh linings, and a flexible sole, they'll keep your feet feeling fresh and supported all day long. Whether you're hitting the trails, running errands, or enjoying a casual day out, these shoes will turn heads wherever you go."
shoes,Derbies and moccasins,Relaxed flat shoes with tie-dye print,2074.4,4068.8,49,16,False,,,Multi color,Nope,https://imgaz1.chiccdn.com/thumb/list_grid/oaupload/newchic/images/E1/E0/1d98031e-f9fd-49a2-b579-52232db61560.jpg,https://imgaz1.chiccdn.com/thumb/view/oaupload/newchic/images/E1/E0/1d98031e-f9fd-49a2-b579-52232db61560.jpg,,,https://imgaz1.chiccdn.com/thumb/view/oaupload/newchic/images/84/6F/a4765c01-d3ef-48e0-81ee-89752629af1e.jpg,1707835,"Slip into comfort and style with our tie-dye printed flats. Adorned with a vibrant, eye-catching pattern, these shoes are perfect for adding a touch of personality to your everyday look. Featuring a laid-back silhouette and cozy, flat sole, they'll keep your feet happy all day long. Whether you're running errands or exploring the town, these flats will effortlessly elevate your style."
shoes,Derbies and moccasins,Large size flats moccasins,1919.1999999999998,3759.2000000000003,49,13,False,,,Black,White,https://imgaz1.chiccdn.com/thumb/list_grid/oaupload/newchic/images/8C/1D/84ca8f1e-0528-45a1-952e-20b4021fcf26.jpg,https://imgaz1.chiccdn.com/thumb/view/oaupload/newchic/images/8C/1D/84ca8f1e-0528-45a1-952e-20b4021fcf26.jpg,https://imgaz1.chiccdn.com/thumb/list_grid/oaupload/newchic/images/63/2E/d4f01dfe-c9a3-43f1-ba05-f2d13fd6803e.jpg,https://imgaz1.chiccdn.com/thumb/view/oaupload/newchic/images/63/2E/d4f01dfe-c9a3-43f1-ba05-f2d13fd6803e.jpg,https://imgaz1.chiccdn.com/thumb/view/oaupload/newchic/images/C2/1B/55cbba88-f685-46ec-8db7-035eed17d3a5.jpg,1711659,"Step in style with our large-size flats moccasins! Crafted from premium materials, these flat shoes offer unparalleled comfort and a timeless design. Their soft, flexible construction ensures a comfortable fit, while the durable outsole provides excellent traction. Perfect for running errands, traveling, or even a casual night out, these flats are a versatile addition to any wardrobe. So slip into these stylish and comfortable moccasins and start walking on the wild side!"
shoes,Sandals,Beach strip sandals for men,3800.7999999999997,8280.0,54,13,False,,,Black,Gray,https://imgaz1.chiccdn.com/thumb/list_grid/oaupload/newchic/images/23/94/277e1354-4902-4402-ac92-8227f01d0322.jpg,https://imgaz1.chiccdn.com/thumb/view/oaupload/newchic/images/23/94/277e1354-4902-4402-ac92-8227f01d0322.jpg,https://imgaz1.chiccdn.com/thumb/list_grid/oaupload/newchic/images/5D/E0/11853ab1-52e7-4b24-94fd-1da1cddeee4d.jpg,https://imgaz1.chiccdn.com/thumb/view/oaupload/newchic/images/5D/E0/11853ab1-52e7-4b24-94fd-1da1cddeee4d.jpg,https://imgaz1.chiccdn.com/thumb/view/oaupload/newchic/images/A9/75/7a56a167-9dbd-41ac-985c-07432bc89113.jpg,1677120,"Slip into these stylish beach strip sandals and embrace the summer vibes. Crafted with a durable sole and comfortable straps, these sandals are perfect for long walks on the beach or a casual stroll around town. Make a statement with their unique design, featuring a vibrant color palette and eye-catching patterns. Step out in style and feel the sand between your toes with these must-have beach strip sandals."
shoes,Derbies and moccasins,Comfortable women's work shoes,1852.8,3592.0,48,23,False,,,# 01,# 02,https://imgaz1.chiccdn.com/thumb/list_grid/oaupload/newchic/images/42/33/6887e988-011a-4733-8959-4a97a540d5c7.jpg,https://imgaz1.chiccdn.com/thumb/view/oaupload/newchic/images/42/33/6887e988-011a-4733-8959-4a97a540d5c7.jpg,https://imgaz1.chiccdn.com/thumb/list_grid/oaupload/newchic/images/29/50/99f7f329-6d0c-407a-ab80-25b131964ae0.jpg,https://imgaz1.chiccdn.com/thumb/view/oaupload/newchic/images/29/50/99f7f329-6d0c-407a-ab80-25b131964ae0.jpg,https://imgaz1.chiccdn.com/thumb/view/oaupload/newchic/images/56/9B/6d45087f-4765-4c4d-b580-24c2b95fde7a.jpg,1693613,"Experience the perfect balance of style and comfort in our women's work shoes. Designed with the modern professional in mind, these shoes offer a sleek and polished look while ensuring all-day foot ease. Crafted from premium materials, they provide exceptional breathability and support, even on those long days on your feet. Step into our comfortable work shoes and elevate your workday style."
shoes,Dress shoes,Elegant Pampilles Moccasins,3727.2000000000003,8104.8,54,14,False,,,Black,Brown,https://imgaz1.chiccdn.com/thumb/list_grid/oaupload/newchic/images/F6/05/07942925-378f-4190-8cc2-9c813f1a6d92.jpg,https://imgaz1.chiccdn.com/thumb/view/oaupload/newchic/images/F6/05/07942925-378f-4190-8cc2-9c813f1a6d92.jpg,https://imgaz1.chiccdn.com/thumb/list_grid/oaupload/newchic/images/B0/74/1d739adc-4360-4e53-be1b-cb2eb9731aa8.jpg,https://imgaz1.chiccdn.com/thumb/view/oaupload/newchic/images/B0/74/1d739adc-4360-4e53-be1b-cb2eb9731aa8.jpg,https://imgaz1.chiccdn.com/thumb/view/oaupload/newchic/images/98/AE/0fcd779f-b37e-40ed-a0cf-88ccdcd11871.jpg,1703141,"Introducing the Elegant Pampilles Moccasins, the epitome of grace and sophistication. Handcrafted with meticulous attention to detail, these moccasins feature a stunning mosaic of vibrant crystals and beads. Their sleek design and luxurious construction make them the perfect choice for any fashion-forward individual seeking to make a statement. From red carpets to casual outings, these moccasins are sure to leave a lasting impression."
shoes,Sandals,Narable exterior sandals in cow's leather for men,3744.8,9798.4,62,26,False,,,Black,Coffee,https://imgaz1.chiccdn.com/thumb/list_grid/oaupload/newchic/images/41/1D/6118473a-29a6-4fa1-bf2f-f76eacd35401.jpg,https://imgaz1.chiccdn.com/thumb/view/oaupload/newchic/images/41/1D/6118473a-29a6-4fa1-bf2f-f76eacd35401.jpg,https://imgaz1.chiccdn.com/thumb/list_grid/oaupload/newchic/images/A1/7F/599dab03-c124-49c7-a0ef-457474d21681.jpg,https://imgaz1.chiccdn.com/thumb/view/oaupload/newchic/images/A1/7F/599dab03-c124-49c7-a0ef-457474d21681.jpg,https://imgaz1.chiccdn.com/thumb/view/oaupload/newchic/images/E4/5F/c9d1fabd-4b3b-43c6-93ab-d380844dbfdd.jpg,1651891,"Introducing our stylish and durable Narable exterior sandals, crafted from high-quality cow's leather. Designed for the modern man seeking comfort, these sandals feature a soft and flexible sole that provides all-day support and cushioning. With their classic design and versatile color options, our sandals add an elegant touch to any casual or semi-formal outfit. Experience the perfect blend of style and functionality with the Narable exterior sandals, your perfect companion for warm-weather adventures."
shoes,Sneakers,Men Knitted Fabrication Casual Running Sneakers,2082.4,4627.200000000001,55,8,False,,,Black,Blue,https://imgaz1.chiccdn.com/thumb/list_grid/oaupload/newchic/images/BB/3D/5a51297b-94b6-4798-882e-c61a95b66bed.jpg,https://imgaz1.chiccdn.com/thumb/view/oaupload/newchic/images/BB/3D/5a51297b-94b6-4798-882e-c61a95b66bed.jpg,https://imgaz1.chiccdn.com/thumb/list_grid/oaupload/newchic/images/53/C9/16965ef9-8ae2-4b85-afb6-d0bd192f5659.jpg,https://imgaz1.chiccdn.com/thumb/view/oaupload/newchic/images/53/C9/16965ef9-8ae2-4b85-afb6-d0bd192f5659.jpg,https://imgaz1.chiccdn.com/thumb/view/oaupload/newchic/images/53/C9/16965ef9-8ae2-4b85-afb6-d0bd192f5659.jpg,1702427,"These men's knitted fabric sneakers are perfect for running. With their breathable mesh upper and lightweight construction, these shoes provide the comfort and support you need to power through your miles. The rubber sole offers traction and durability, while the stylish design keeps you looking your best. Whether you're running to stay in shape, compete in a race, or just for the fun of it, these sneakers will help you reach your goals."
shoes,Derbies and moccasins,Woman Casual Shoes Plates Large Color Pure Color Ballets Lace,1439.1999999999998,4562.4,69,3225,False,,,Pink,Light blue,https://imgaz1.chiccdn.com/thumb/list_grid/oaupload/newchic/images/DF/36/9eba2433-07da-449f-b9a7-8cc39f9b877e.jpg,https://imgaz1.chiccdn.com/thumb/view/oaupload/newchic/images/DF/36/9eba2433-07da-449f-b9a7-8cc39f9b877e.jpg,https://imgaz1.chiccdn.com/thumb/list_grid/oaupload/newchic/images/91/F0/98a01624-a441-4a36-8da9-bb2a40d0e3db.jpg,https://imgaz1.chiccdn.com/thumb/view/oaupload/newchic/images/91/F0/98a01624-a441-4a36-8da9-bb2a40d0e3db.jpg,https://imgaz1.chiccdn.com/thumb/view/oaupload/newchic/images/09/78/906334da-fec2-4f2d-b6b2-4e9a7df737d0.jpg,1036120,"Elevate your style with these exquisite casual shoes, designed to provide both comfort and elegance. Crafted from premium materials, these shoes feature a pure color palette, exuding a timeless appeal. The lace-up closure ensures a secure fit, while the soft and flexible soles make every step a delight. Perfect for any occasion, these shoes will elevate your wardrobe and elevate your confidence."
shoes,Derbies and moccasins,Socofy leather shoes in fantastic forest,3999.2000000000003,10919.2,63,1887,False,Socofy,https://fr.newchic.com/socofy-brand-298.html,Blue,Nope,https://imgaz1.chiccdn.com/thumb/list_grid/oaupload/newchic/images/C3/51/64c156c6-755d-4f31-923e-39ba41c81dc5.JPG,https://imgaz1.chiccdn.com/thumb/view/oaupload/newchic/images/C3/51/64c156c6-755d-4f31-923e-39ba41c81dc5.JPG,,,https://imgaz1.chiccdn.com/thumb/view/oaupload/newchic/images/BD/40/a5b2069f-c312-41f1-bd71-610b59a11946.JPG,1280803,"Embrace the wild spirit with Socofy leather shoes, handcrafted from premium materials for a rugged yet refined look. Embark on a fashion adventure wearing these shoes, designed to endure life's twists and turns, offering both comfort and style. Made with the finest craftsmanship, Socofy elevates your footwear game, turning every step into a confident stride."
shoes,Sandals and mules,Socofy bohemian cutting hook open end open back bare back heel heel heeled sandals,3999.2000000000003,11679.2,66,59,False,Socofy,https://fr.newchic.com/socofy-brand-298.html,Beige,Nope,https://imgaz1.chiccdn.com/thumb/list_grid/oaupload/newchic/images/BA/25/14467979-f635-418d-8643-0f15ce5c39d5.JPG,https://imgaz1.chiccdn.com/thumb/view/oaupload/newchic/images/BA/25/14467979-f635-418d-8643-0f15ce5c39d5.JPG,,,https://imgaz1.chiccdn.com/thumb/view/oaupload/newchic/images/BA/25/14467979-f635-418d-8643-0f15ce5c39d5.JPG,1682981,"Step into bohemian style with our unique cutting hook open end open back heel heeled sandals. These exquisite sandals blend fashion and comfort, featuring intricate cutout designs and a trendy open toe. Crafted with a sturdy heel and a convenient open back, they provide a confident stride and a touch of easy elegance. Enhance your wardrobe with these sandals, perfect for any occasion, from a day out with friends to a romantic evening."
shoes,Boots & boots,Size plus ankle storage steady anti -pointed,3199.2000000000003,6399.2,50,93,False,,,Black,Blue,https://imgaz1.chiccdn.com/thumb/list_grid/oaupload/ser1/newchic/images/99/49/cb1d49b7-cb6f-48e7-a541-afc7ab8df4df.JPG,https://imgaz1.chiccdn.com/thumb/view/oaupload/ser1/newchic/images/99/49/cb1d49b7-cb6f-48e7-a541-afc7ab8df4df.JPG,https://imgaz1.chiccdn.com/thumb/list_grid/oaupload/ser1/newchic/images/3D/B0/c1b42939-e247-45e1-ae73-3c6f3bca21b8.JPG,https://imgaz1.chiccdn.com/thumb/view/oaupload/ser1/newchic/images/3D/B0/c1b42939-e247-45e1-ae73-3c6f3bca21b8.JPG,https://imgaz1.chiccdn.com/thumb/view/oaupload/ser1/newchic/images/ED/1F/c28d2fd5-9943-4bca-851d-c50dffc37e11.jpg,1616139,"Maximize your comfort and style with our Size Plus Ankle Storage Steady Anti-Pointed Shoes. Designed for those with wider feet, these shoes offer ample space and support for all-day wear. Experience the epitome of comfort with the soft, breathable lining and flexible outsole. Anti-slip technology ensures stability on various surfaces, while the sharp, edgy design keeps you looking your best. Whether you're tackling a busy day or stepping out for a night on the town, these shoes have you covered."
shoes,Sneakers,Breathing sneakers in knitting for men,4188.0,9280.0,55,24,False,,,White,Black,https://imgaz1.chiccdn.com/thumb/list_grid/oaupload/newchic/images/73/C3/d3866f11-6450-40e3-9066-964abe1492bc.jpg,https://imgaz1.chiccdn.com/thumb/view/oaupload/newchic/images/73/C3/d3866f11-6450-40e3-9066-964abe1492bc.jpg,https://imgaz1.chiccdn.com/thumb/list_grid/oaupload/newchic/images/68/0E/f7846a69-7225-4b6d-8558-21595d83ad9b.jpg,https://imgaz1.chiccdn.com/thumb/view/oaupload/newchic/images/68/0E/f7846a69-7225-4b6d-8558-21595d83ad9b.jpg,https://imgaz1.chiccdn.com/thumb/view/oaupload/newchic/images/FB/DB/18d94c5e-0270-4b8c-a4f6-5e3e639497ad.jpg,1686887,"These breathable sneakers are designed to keep your feet cool and comfortable all day long. Made with a lightweight knitting upper, these shoes allow air to circulate, preventing sweat and odor from building up. The flexible rubber sole provides excellent traction and support, while the cushioned insole ensures a comfortable fit. Whether you're running errands, going for a walk, or hitting the gym, these sneakers are the perfect choice for any active man."
shoes,Sneakers and sneakers,Flat sneakers with retro printing,6079.2,11359.2,47,25,False,Socofy,https://fr.newchic.com/socofy-brand-298.html,Black,Nope,https://imgaz1.chiccdn.com/thumb/list_grid/oaupload/newchic/images/21/FD/73a70ba1-f1e5-4480-b64c-7c27a60e1fe1.jpg,https://imgaz1.chiccdn.com/thumb/view/oaupload/newchic/images/21/FD/73a70ba1-f1e5-4480-b64c-7c27a60e1fe1.jpg,,,https://imgaz1.chiccdn.com/thumb/view/oaupload/newchic/images/8D/85/e3dbdc4f-ed0e-44f9-8d72-eb5d32000548.jpg,1708526,"Introducing our retro-inspired flat sneakers, the perfect blend of fashion and comfort. With striking vintage prints that turn heads, these sneakers will add a touch of nostalgia to your everyday style. Designed for all-day wear, their lightweight and flexible construction ensures a comfortable stride, whether you're running errands or exploring new cities. Step into the past and embrace the future of footwear with our retro flat sneakers."
shoes,Pumps,Thick leather heeled pumps,4799.2,13188.0,64,133,False,Socofy,https://fr.newchic.com/socofy-brand-298.html,red,Nope,https://imgaz1.chiccdn.com/thumb/list_grid/oaupload/newchic/images/21/43/f6e7407d-9b07-494d-b9b2-42d6b6b8767e.JPG,https://imgaz1.chiccdn.com/thumb/view/oaupload/newchic/images/21/43/f6e7407d-9b07-494d-b9b2-42d6b6b8767e.JPG,,,https://imgaz1.chiccdn.com/thumb/view/oaupload/newchic/images/06/EC/0c0e7414-9a3c-47bb-ae6b-038713a3a895.JPG,1655202,"Elevate your style and confidence with these luxurious thick leather heeled pumps. Crafted from premium leather, these pumps offer both comfort and durability. The chic design features a classic silhouette and a chunky heel, making them perfect for any occasion. Whether you're dressing up for a night out or adding a touch of sophistication to your everyday look, these heels will turn heads wherever you go."
shoes,Sandals and mules,Open -end flat beach sandals,1830.3999999999999,3679.2000000000003,50,13,False,,,YELLOW,red,https://imgaz1.chiccdn.com/thumb/list_grid/oaupload/newchic/images/7C/67/4a7d7eb6-2218-47ce-9b82-31486c4f8c5c.jpg,https://imgaz1.chiccdn.com/thumb/view/oaupload/newchic/images/7C/67/4a7d7eb6-2218-47ce-9b82-31486c4f8c5c.jpg,https://imgaz1.chiccdn.com/thumb/list_grid/oaupload/newchic/images/D3/FC/f09ccbe7-6b8b-4629-83bf-42931cf8326d.jpg,https://imgaz1.chiccdn.com/thumb/view/oaupload/newchic/images/D3/FC/f09ccbe7-6b8b-4629-83bf-42931cf8326d.jpg,https://imgaz1.chiccdn.com/thumb/view/oaupload/newchic/images/E3/D1/7f14fa7f-500a-4e2c-97bf-69a42cb82caf.jpg,1711695,"Slip into ultimate comfort and style with these open-end flat beach sandals. Crafted with a soft, flexible sole, these sandals gently conform to the contours of your feet, providing a cloud-like cushioning with every step. The open-toe design promotes breathability, keeping your feet cool and fresh, while the flat construction ensures optimal stability. Perfect for strolling along the shore or running errands around town, these versatile sandals are a must-have for any summer wardrobe."
shoes,Tilters and flip flops,Large flat slopes with closed and breathable,959.2,1919.1999999999998,50,14,False,,,Black,Blue,https://imgaz1.chiccdn.com/thumb/list_grid/oaupload/newchic/images/52/05/1010adca-8f1a-453c-8cfb-2e1a69236a5c.jpg,https://imgaz1.chiccdn.com/thumb/view/oaupload/newchic/images/52/05/1010adca-8f1a-453c-8cfb-2e1a69236a5c.jpg,https://imgaz1.chiccdn.com/thumb/list_grid/oaupload/newchic/images/F3/72/d5485e6b-f981-44ab-a6d7-06421802fd01.jpg,https://imgaz1.chiccdn.com/thumb/view/oaupload/newchic/images/F3/72/d5485e6b-f981-44ab-a6d7-06421802fd01.jpg,https://imgaz1.chiccdn.com/thumb/view/oaupload/newchic/images/89/1A/e0f1ec5b-21c6-4de4-a9ad-51316bc39fc2.jpg,1699958,"Step into comfort and style with our large flat slopes. The unique, wide design offers incredible stability while the breathable material ensures all-day freshness. These shoes are perfect for casual outings or long walks, providing unparalleled comfort with every stride. Don't miss out on this must-have addition to your footwear collection."
shoes,Sneakers,Standcraft outdoor backbone sneakers in men's mesh,3439.2000000000003,7756.799999999999,56,15,False,,,Green,Black,https://imgaz1.chiccdn.com/thumb/list_grid/oaupload/newchic/images/47/4E/f0e84299-568c-4821-8c98-d285232a3a54.jpg,https://imgaz1.chiccdn.com/thumb/view/oaupload/newchic/images/47/4E/f0e84299-568c-4821-8c98-d285232a3a54.jpg,https://imgaz1.chiccdn.com/thumb/list_grid/oaupload/newchic/images/C2/6C/07c21268-e3c7-40f3-8bd1-6de5140b4d8b.jpg,https://imgaz1.chiccdn.com/thumb/view/oaupload/newchic/images/C2/6C/07c21268-e3c7-40f3-8bd1-6de5140b4d8b.jpg,https://imgaz1.chiccdn.com/thumb/view/oaupload/newchic/images/03/BF/e284b679-4f0f-4e1b-a88a-a1e83c346519.jpg,1685137,"Experience the epitome of comfort and style with Standcraft Men's Mesh Outdoor Backbone Sneakers. These sneakers seamlessly blend functionality and fashion, crafted with breathable mesh uppers for unparalleled ventilation and lightweight construction for all-day wear. The durable soles provide exceptional traction, making them perfect for outdoor adventures, while the sleek design ensures you stay on-trend. Step into Standcraft's Backbone Sneakers and elevate your footwear game."
shoes,Shoes accessories,Forefoot Ballet Insole Insole Carpet,1143.1999999999998,2210.4,48,530,False,,,Orange,white,https://imgaz1.chiccdn.com/thumb/list_grid/oaupload/newchic/images/61/62/20140520105954930.jpg,https://imgaz1.chiccdn.com/thumb/view/oaupload/newchic/images/61/62/20140520105954930.jpg,https://imgaz1.chiccdn.com/thumb/list_grid/oaupload/newchic/images/61/62/20140520105944190.jpg,https://imgaz1.chiccdn.com/thumb/view/oaupload/newchic/images/61/62/20140520105944190.jpg,https://imgaz1.chiccdn.com/thumb/view/oaupload/newchic/images/61/62/20140520105950556.jpg,928288,"These Forefoot Ballet Insole Insole Carpet are perfect for ballet and dancing lovers. They provide extra cushioning and support to the ball of your foot, making them ideal for prolonged standing or dancing. The carpet material helps absorb shock and reduce pressure on your feet, while the forefoot design helps keep your toes in the correct position. Wear these insoles with your favorite shoes to add a touch of comfort and style."
