category,subcategory,name,current_price,raw_price,discount,likes_count,is_new,brand,brand_url,variation_0_color,variation_1_color,variation_0_thumbnail,variation_0_image,variation_1_thumbnail,variation_1_image,image_url,id,description
shoes,Sneakers and sneakers,Flat mesh flat shoes breathable,1335.2,5543.200000000001,76,4843,False,,,Black,Pink,https://imgaz1.chiccdn.com/thumb/list_grid/oaupload/newchic/images/80/91/350380af-e22d-496e-bc86-0721ed06c2a1.jpg,https://imgaz1.chiccdn.com/thumb/view/oaupload/newchic/images/80/91/350380af-e22d-496e-bc86-0721ed06c2a1.jpg,https://imgaz1.chiccdn.com/thumb/list_grid/oaupload/newchic/images/07/F9/a892922b-291c-484e-84cf-9f6c367f9a43.jpg,https://imgaz1.chiccdn.com/thumb/view/oaupload/newchic/images/07/F9/a892922b-291c-484e-84cf-9f6c367f9a43.jpg,https://imgaz1.chiccdn.com/thumb/view/oaupload/newchic/images/DD/D1/b6250d23-1c79-4785-95a5-bab5c6a4308a.jpg,1414411,"Step into comfort and style with these flat mesh flat shoes. Crafted with breathability in mind, these shoes feature a lightweight mesh upper that keeps your feet cool and dry all day long. The flexible sole provides excellent traction and cushioning, ensuring a comfortable walking experience. Perfect for casual wear, these shoes will keep you looking and feeling your best."
shoes,Sandals and mules,Straw rear strap,1919.1999999999998,3972.0,52,69,False,,,YELLOW,Apricot,https://imgaz1.chiccdn.com/thumb/list_grid/oaupload/newchic/images/AA/D9/3860a6b1-c1bb-4684-8127-c919d381de55.JPG,https://imgaz1.chiccdn.com/thumb/view/oaupload/newchic/images/AA/D9/3860a6b1-c1bb-4684-8127-c919d381de55.JPG,https://imgaz1.chiccdn.com/thumb/list_grid/oaupload/newchic/images/E0/EF/21e54a34-ea61-40dd-a0f5-615e016f1cc2.JPG,https://imgaz1.chiccdn.com/thumb/view/oaupload/newchic/images/E0/EF/21e54a34-ea61-40dd-a0f5-615e016f1cc2.JPG,https://imgaz1.chiccdn.com/thumb/view/oaupload/newchic/images/61/FC/f6eeeee1-c1d0-4ee7-a35b-a1558a8e63d3.jpg,1681615,"Complete your fashionable look with our trendy straw rear straps! Made with high-quality materials, these rear straps are both stylish and durable. With its unique design, these straps can be used to add a touch of summer flair to any outfit, from casual to formal. Whether you're hitting the beach, a garden party, a summer wedding, or a night out in town, these rear straps will make you stand out from the crowd. Pair them with sandals, sneakers, or heels, and experience the perfect balance of fashion and comfort!"
shoes,Moccasins,Naust -off in canvas lavished for men's canvas,2074.4,3898.3999999999996,47,61,False,,,Blue,Gray,https://imgaz1.chiccdn.com/thumb/list_grid/oaupload/newchic/images/4A/B8/de52f694-a963-4c10-ab75-acacb7702b6a.jpg,https://imgaz1.chiccdn.com/thumb/view/oaupload/newchic/images/4A/B8/de52f694-a963-4c10-ab75-acacb7702b6a.jpg,https://imgaz1.chiccdn.com/thumb/list_grid/oaupload/newchic/images/0D/74/ca540afe-e55e-4cd8-aff5-a80466355a4b.jpg,https://imgaz1.chiccdn.com/thumb/view/oaupload/newchic/images/0D/74/ca540afe-e55e-4cd8-aff5-a80466355a4b.jpg,https://imgaz1.chiccdn.com/thumb/view/oaupload/newchic/images/6F/88/2c6498fa-4f2b-4207-a417-e9d19bb85bb3.jpg,1703264,"Our Naust off-in canvas, lavished for men, is a true game-changer in the world of footwear. Handcrafted with premium canvas and detailed stitching, this timeless design effortlessly blends classic style with modern comfort. The durable rubber sole ensures all-day support and traction, while the breathable lining keeps you cool and dry. Step up your style and experience the exceptional quality of our Naust off-in canvas, the perfect choice for the discerning gentleman."
shoes,Derbies and moccasins,Socofy flat shoes handmade in real leather leather flexible moccasins flower style,2799.2000000000003,5510.4,49,12227,False,Socofy,https://fr.newchic.com/socofy-brand-298.html,YELLOW,Blue,https://imgaz1.chiccdn.com/thumb/list_grid/oaupload/newchic/images/20/01/3a8d2e86-7763-412f-9c39-538971ff3121.jpg,https://imgaz1.chiccdn.com/thumb/view/oaupload/newchic/images/20/01/3a8d2e86-7763-412f-9c39-538971ff3121.jpg,https://imgaz1.chiccdn.com/thumb/list_grid/oaupload/newchic/images/29/8A/f1619ef2-8c9d-4f9f-8d1c-03c8f0fbb540.jpg,https://imgaz1.chiccdn.com/thumb/view/oaupload/newchic/images/29/8A/f1619ef2-8c9d-4f9f-8d1c-03c8f0fbb540.jpg,https://imgaz1.chiccdn.com/thumb/view/oaupload/newchic/images/8F/F9/4a9e58a7-3adc-4493-99fa-d0cb8fc62d26.jpg,1113128,"Step into comfort and style with our Socofy flat shoes, meticulously crafted from genuine leather. Experience the luxurious feel of real leather while enjoying the flexibility of a moccasin. Handcrafted with intricate flower detailing, these shoes elevate your everyday look with effortless grace. Available in a range of colors to match your unique style."
shoes,Sneakers,Large men sewing outdoor sneakers,3359.2000000000003,6479.2,48,547,False,,,brown,Blue,https://imgaz1.chiccdn.com/thumb/list_grid/oaupload/newchic/images/B0/51/7671b3ab-ccbf-4cb0-9e48-2960aa6d8b54.jpg,https://imgaz1.chiccdn.com/thumb/view/oaupload/newchic/images/B0/51/7671b3ab-ccbf-4cb0-9e48-2960aa6d8b54.jpg,https://imgaz1.chiccdn.com/thumb/list_grid/oaupload/newchic/images/92/6A/3b3d72c1-c45e-413d-9a39-90c9917fe9f8.jpg,https://imgaz1.chiccdn.com/thumb/view/oaupload/newchic/images/92/6A/3b3d72c1-c45e-413d-9a39-90c9917fe9f8.jpg,https://imgaz1.chiccdn.com/thumb/view/oaupload/newchic/images/42/9D/dcabe8a0-3995-44ac-b0f8-072206128c5e.jpg,1450381,"Step into remarkable comfort and style with our selection of large men's sewing outdoor sneakers. Combining functionality and fashion, these sneakers are designed to provide the perfect blend of support, durability, and style for your active lifestyle. Crafted from premium materials and equipped with advanced features, our sneakers ensure a smooth and secure fit while delivering maximum breathability and flexibility. Discover a versatile footwear option that seamlessly transitions from the workshop to the great outdoors, allowing you to conquer any terrain with confidence."
shoes,Derbies and moccasins,Closed end backless soft mules shoes,799.2,1599.1999999999998,50,233,False,,,Black,Pink,https://imgaz1.chiccdn.com/thumb/list_grid/oaupload/newchic/images/CC/6F/7c49b72b-4ab1-4552-b989-bf7c9dfea9d9.jpg,https://imgaz1.chiccdn.com/thumb/view/oaupload/newchic/images/CC/6F/7c49b72b-4ab1-4552-b989-bf7c9dfea9d9.jpg,https://imgaz1.chiccdn.com/thumb/list_grid/oaupload/newchic/images/3D/9B/a732aa78-0be2-4a5b-9666-15851c9e6860.jpg,https://imgaz1.chiccdn.com/thumb/view/oaupload/newchic/images/3D/9B/a732aa78-0be2-4a5b-9666-15851c9e6860.jpg,https://imgaz1.chiccdn.com/thumb/view/oaupload/newchic/images/DF/F8/a8ba2201-28ca-4017-94a7-f6254b47ccd5.jpg,1693271,"Step into comfort and style with our Closed end backless soft mules shoes, crafted with premium materials to provide an exceptional walking experience. The soft, plush lining molds to your feet for a customized fit, while the backless design offers a touch of sophistication. Experience the perfect blend of fashion and functionality with these versatile mules, perfect for any occasion."
shoes,Sandals,Water sandals with rubber tip for men,3980.0,9732.0,59,144,False,,,Black,Brown,https://imgaz1.chiccdn.com/thumb/list_grid/oaupload/newchic/images/61/D3/e8db6d91-4b25-44ac-b643-5e9fdf4040de.jpg,https://imgaz1.chiccdn.com/thumb/view/oaupload/newchic/images/61/D3/e8db6d91-4b25-44ac-b643-5e9fdf4040de.jpg,https://imgaz1.chiccdn.com/thumb/list_grid/oaupload/newchic/images/27/23/81ed8c90-bb8c-47ee-b013-0ce0dc49e4a9.jpg,https://imgaz1.chiccdn.com/thumb/view/oaupload/newchic/images/27/23/81ed8c90-bb8c-47ee-b013-0ce0dc49e4a9.jpg,https://imgaz1.chiccdn.com/thumb/view/oaupload/newchic/images/B6/00/d80d3a62-8835-4113-b0d6-181ad8b63bd5.jpg,1667625,"Experience the ultimate comfort and style with our water sandals designed exclusively for men. These sandals feature a unique combination of water-resistant materials and a rubber tip, making them the perfect choice for a variety of activities, whether it's hitting the beach, exploring the outdoors, or simply relaxing by the pool. With their flexible design and superior traction, these sandals ensure a secure and comfortable fit, ensuring you feel confident and supported with every step."
shoes,Sandals and mules,Socofy Sandals Entrelated Plate Made Hand -Made with Elastic Range,2076.8,4215.2,51,6653,False,,,brown,Beige,https://imgaz1.chiccdn.com/thumb/list_grid/oaupload/newchic/images/3F/F0/47f7604a-2158-4ed5-852f-a2557b1708c1.JPG,https://imgaz1.chiccdn.com/thumb/view/oaupload/newchic/images/3F/F0/47f7604a-2158-4ed5-852f-a2557b1708c1.JPG,https://imgaz1.chiccdn.com/thumb/list_grid/oaupload/newchic/images/C8/F4/94b18dd8-0f13-4b6d-b3ac-27eb9bd1bde6.JPG,https://imgaz1.chiccdn.com/thumb/view/oaupload/newchic/images/C8/F4/94b18dd8-0f13-4b6d-b3ac-27eb9bd1bde6.JPG,https://imgaz1.chiccdn.com/thumb/view/oaupload/newchic/images/73/67/c0b2e210-0b85-4d8a-ad52-c40a1406d156.jpg,1171578,"These elegant Socofy Sandals feature a handcrafted interwoven elastic design, ensuring a secure and comfortable fit. Made with attention to detail, these sandals offer a unique and stylish look, complemented by their intricate lace accents. Slip on these sandals to elevate any casual outfit, from summer dresses to jeans and a tee. Experience the fusion of fashion and comfort with every step."
shoes,Sandals,Menico leather sandals for soft men,4049.6,8478.4,52,756,False,,,Brown yellow,Red-maron,https://imgaz1.chiccdn.com/thumb/list_grid/oaupload/newchic/images/AC/8B/608b2ad2-f896-40ea-9eba-d07fca244601.jpg,https://imgaz1.chiccdn.com/thumb/view/oaupload/newchic/images/AC/8B/608b2ad2-f896-40ea-9eba-d07fca244601.jpg,https://imgaz1.chiccdn.com/thumb/list_grid/oaupload/newchic/images/5B/D6/b4bf3389-bf58-413d-a156-833723906cee.jpg,https://imgaz1.chiccdn.com/thumb/view/oaupload/newchic/images/5B/D6/b4bf3389-bf58-413d-a156-833723906cee.jpg,https://imgaz1.chiccdn.com/thumb/view/oaupload/newchic/images/C7/83/81af3546-0ba4-4c54-8e2e-4711207d4c58.jpg,1430908,"Slip into comfort with our Menico leather sandals crafted just for the modern man. Made from genuine leather, these sandals provide a soft and luxurious feel against your skin. With a minimalistic design featuring intricate stitching detailing and an ergonomic sole, these sandals promise both style and unbeatable comfort. Available in various colors, they're the perfect finishing touch to your casual or semi-formal outfits. Step up your style with Menico sandals and experience a new level of comfort."
shoes,Sandals and mules,MULES rear strap leather sandals,5279.2,9813.6,46,398,False,Socofy,https://fr.newchic.com/socofy-brand-298.html,Blue,Nope,https://imgaz1.chiccdn.com/thumb/list_grid/oaupload/newchic/images/7D/E5/d8a51755-ac9d-4978-8ae1-f19a30d0d4a7.JPG,https://imgaz1.chiccdn.com/thumb/view/oaupload/newchic/images/7D/E5/d8a51755-ac9d-4978-8ae1-f19a30d0d4a7.JPG,,,https://imgaz1.chiccdn.com/thumb/view/oaupload/newchic/images/7D/E5/d8a51755-ac9d-4978-8ae1-f19a30d0d4a7.JPG,1666362,"Step out in style and comfort with our MULES rear strap leather sandals. Crafted from premium leather, these sandals offer a luxurious feel and long-lasting durability. Featuring an adjustable rear strap for a secure fit, these sandals allow for easy on-and-off wear. The open-toe design provides breathability, making them perfect for warm-weather days. Their sleek design pairs perfectly with both casual and dressy outfits, making them a versatile addition to any wardrobe."
shoes,Sandals and mules,Elastic closed end strip flat sandals,2639.2000000000003,5279.2,50,1350,False,,,Black,red,https://imgaz1.chiccdn.com/thumb/list_grid/oaupload/newchic/images/F9/FD/eaccc4a4-8f3e-4480-8557-e28421464e89.jpeg,https://imgaz1.chiccdn.com/thumb/view/oaupload/newchic/images/F9/FD/eaccc4a4-8f3e-4480-8557-e28421464e89.jpeg,https://imgaz1.chiccdn.com/thumb/list_grid/oaupload/newchic/images/B2/61/9ee9c05c-4ed7-4bea-a52f-13b1972c318f.jpeg,https://imgaz1.chiccdn.com/thumb/view/oaupload/newchic/images/B2/61/9ee9c05c-4ed7-4bea-a52f-13b1972c318f.jpeg,https://imgaz1.chiccdn.com/thumb/view/oaupload/newchic/images/A4/15/c25b237b-c8fc-4882-9841-26ed9caebb8f.png,1494570,"Step into effortless style with our elastic closed-end strip flat sandals. Crafted with premium materials and a chic design, these sandals offer a balance of comfort and fashion. The elastic band ensures a secure fit, while the flat heel provides all-day wearability. Perfect for casual outings, these sandals will add a touch of elegance to any outfit."
shoes,Sneakers and sneakers,Beathable platform shoes,1039.2,1975.2,47,9,True,,,Black,Purple,https://imgaz1.chiccdn.com/thumb/list_grid/oaupload/newchic/images/E0/32/2e2c7a90-f616-40ed-912f-ac38decc74fd.jpg,https://imgaz1.chiccdn.com/thumb/view/oaupload/newchic/images/E0/32/2e2c7a90-f616-40ed-912f-ac38decc74fd.jpg,https://imgaz1.chiccdn.com/thumb/list_grid/oaupload/newchic/images/C8/16/1c5eaa31-9197-4778-81b2-aadaaa76d1f9.jpg,https://imgaz1.chiccdn.com/thumb/view/oaupload/newchic/images/C8/16/1c5eaa31-9197-4778-81b2-aadaaa76d1f9.jpg,https://imgaz1.chiccdn.com/thumb/view/oaupload/newchic/images/30/21/ecc3a20d-8dfa-4a15-bbcc-b3efd8cddc43.jpg,1719016,"Step into effortless style and comfort with our breathable platform shoes. Combining fashion and functionality, these shoes feature a platform design that adds height without compromising on stability. Crafted with breathable materials, they keep your feet cool and fresh all day long. Perfect for everyday wear, these shoes are the perfect blend of trend and comfort. Elevate your look and enjoy the comfort of our breathable platform shoes today!"
shoes,Sandals and mules,Beach wedge sandals,1740.8000000000002,3516.8,51,28,False,,,Beige,Blue,https://imgaz1.chiccdn.com/thumb/list_grid/oaupload/newchic/images/03/2B/2a396201-a0be-4929-84d4-8c05c90d15aa.jpeg,https://imgaz1.chiccdn.com/thumb/view/oaupload/newchic/images/03/2B/2a396201-a0be-4929-84d4-8c05c90d15aa.jpeg,https://imgaz1.chiccdn.com/thumb/list_grid/oaupload/newchic/images/B5/3A/66baef35-ee51-494f-95ce-05f3ef590d2a.jpeg,https://imgaz1.chiccdn.com/thumb/view/oaupload/newchic/images/B5/3A/66baef35-ee51-494f-95ce-05f3ef590d2a.jpeg,https://imgaz1.chiccdn.com/thumb/view/oaupload/newchic/images/16/E2/7949d3c6-70be-49f6-8340-c34172f744e0.jpeg,1681460,"Step into summer with our stylish beach wedge sandals! Crafted with lightweight materials and a comfortable wedge heel, these sandals will keep you looking and feeling your best all day long. The adjustable ankle strap ensures a secure fit, while the open-toe design provides breathability and a touch of elegance. Perfect for beach days, casual outings, and more, these sandals are the ultimate in summer footwear."
shoes,Sneakers and sneakers,Sport sneakers with platform,2399.2,4770.400000000001,50,68,False,,,Black,Purple,https://imgaz1.chiccdn.com/thumb/list_grid/oaupload/newchic/images/B1/53/4baf9262-79c1-4e7f-aa55-ec6ffda3733b.jpg,https://imgaz1.chiccdn.com/thumb/view/oaupload/newchic/images/B1/53/4baf9262-79c1-4e7f-aa55-ec6ffda3733b.jpg,https://imgaz1.chiccdn.com/thumb/list_grid/oaupload/newchic/images/4E/81/377abb3a-740d-4601-b9ec-1896df90f26f.jpg,https://imgaz1.chiccdn.com/thumb/view/oaupload/newchic/images/4E/81/377abb3a-740d-4601-b9ec-1896df90f26f.jpg,https://imgaz1.chiccdn.com/thumb/view/oaupload/newchic/images/D0/AC/a84ecba6-421b-4476-9739-4df08a36ca95.jpg,1687984,"Elevate your training and everyday style with these sleek sport sneakers. Featuring a platform design for added height and stability, these sneakers offer well-cushioned comfort that will keep you going strong. Rock them in the gym or pair them with casual attire for an effortlessly sporty look."
shoes,Sandals and mules,Leather wedge sandals,3679.2000000000003,9965.599999999999,63,91,False,Socofy,https://fr.newchic.com/socofy-brand-298.html,Red,Nope,https://imgaz1.chiccdn.com/thumb/list_grid/oaupload/newchic/images/11/05/30252d1f-2687-450b-b20e-14ac08d7eb7f.JPG,https://imgaz1.chiccdn.com/thumb/view/oaupload/newchic/images/11/05/30252d1f-2687-450b-b20e-14ac08d7eb7f.JPG,,,https://imgaz1.chiccdn.com/thumb/view/oaupload/newchic/images/9C/61/2c66e008-2be7-4953-885b-d5a51307e7d5.JPG,1666366,"These stylish leather wedge sandals are the perfect addition to any summer wardrobe. Crafted from premium leather, they are durable and comfortable to wear, while the wedge heel provides a bit of extra height without sacrificing comfort. The sandals feature a chic open-toe design, allowing your feet to breathe on hot days. Whether you're dressing up for a special occasion or just running errands, these sandals will keep you looking and feeling your best."
shoes,Derbies and moccasins,Women Penny Loafers,1788.0,3560.0,50,48,False,Lostisy,https://fr.newchic.com/lostisy-brand-1714.html,YELLOW,brown,https://imgaz1.chiccdn.com/thumb/list_grid/oaupload/newchic/images/A6/38/25947f9c-b772-4782-9d8a-cde3a0f2eb93.JPG,https://imgaz1.chiccdn.com/thumb/view/oaupload/newchic/images/A6/38/25947f9c-b772-4782-9d8a-cde3a0f2eb93.JPG,https://imgaz1.chiccdn.com/thumb/list_grid/oaupload/newchic/images/36/16/6a2f9842-c9c6-4125-89ae-7817b5f11157.JPG,https://imgaz1.chiccdn.com/thumb/view/oaupload/newchic/images/36/16/6a2f9842-c9c6-4125-89ae-7817b5f11157.JPG,https://imgaz1.chiccdn.com/thumb/view/oaupload/newchic/images/9E/0F/e01d1fd3-9e80-4e57-ae6f-bd552280fb34.jpg,1694877,"Introducing our classic Women Penny Loafers, the perfect blend of timeless style and versatile comfort. Crafted from premium leather, these loafers feature a sleek penny loafer design adorned with a sophisticated penny strap. With their durable construction, non-slip rubber sole, and cushioned insole, these loafers are perfect for the modern woman on the go, ensuring comfort and elegance for all-day wear. Step into confidence with our Women Penny Loafers, the epitome of style and practicality."
shoes,Slice,Flower square toe,1519.1999999999998,3039.2000000000003,50,9,False,,,Green,Black,https://imgaz1.chiccdn.com/thumb/list_grid/oaupload/newchic/images/F7/81/09be2197-9d45-4d36-a0d9-dbbec96618b0.jpg,https://imgaz1.chiccdn.com/thumb/view/oaupload/newchic/images/F7/81/09be2197-9d45-4d36-a0d9-dbbec96618b0.jpg,https://imgaz1.chiccdn.com/thumb/list_grid/oaupload/newchic/images/ED/9F/40778374-4c70-419f-a5d6-44e1d2f2ef9d.jpg,https://imgaz1.chiccdn.com/thumb/view/oaupload/newchic/images/ED/9F/40778374-4c70-419f-a5d6-44e1d2f2ef9d.jpg,https://imgaz1.chiccdn.com/thumb/view/oaupload/newchic/images/4E/94/30fc26c0-4f4c-4175-8b78-8be013f63554.jpg,1714088,"Step into the realm of effortless elegance with our Flower square toe shoes. Experience the fusion of classic square toe design and the enchanting charm of floral accents. These shoes are adorned with intricate floral appliques, adding a touch of femininity to your everyday style. Made from premium materials, these shoes provide both comfort and durability, ensuring you feel as fabulous as you look. Whether dressing up for a special occasion or adding a touch of sophistication to your casual attire, these shoes are a must-have in your wardrobe."
shoes,Sneakers and sneakers,Flat walking shoes to put on in soft knit,2375.2000000000003,4799.2,51,34,False,,,Black,White,https://imgaz1.chiccdn.com/thumb/list_grid/oaupload/newchic/images/71/41/79778b6c-2bdb-4bf3-b020-d258ca96af0a.jpg,https://imgaz1.chiccdn.com/thumb/view/oaupload/newchic/images/71/41/79778b6c-2bdb-4bf3-b020-d258ca96af0a.jpg,https://imgaz1.chiccdn.com/thumb/list_grid/oaupload/newchic/images/21/10/23270d68-27ba-4ba1-944a-0248ab2c5cf7.jpg,https://imgaz1.chiccdn.com/thumb/view/oaupload/newchic/images/21/10/23270d68-27ba-4ba1-944a-0248ab2c5cf7.jpg,https://imgaz1.chiccdn.com/thumb/view/oaupload/newchic/images/21/10/23270d68-27ba-4ba1-944a-0248ab2c5cf7.jpg,1684921,"Step as light as a feather with our flat walking shoes, the perfect companion for your daily adventures. Crafted from soft knit, these shoes effortlessly adapt to the shape of your feet, providing a custom-like fit. Experience the pleasure of walking on clouds, whether you're strolling through the park or traversing the city streets. Their versatile design complements any outfit, making them your go-to choice for both casual and dressy occasions."
shoes,Sneakers,Men's sport racing shoes,3191.2,6699.2,52,36,False,,,Black,White,https://imgaz1.chiccdn.com/thumb/list_grid/oaupload/newchic/images/C7/DA/e57c8ffb-6f3a-474c-8399-89cbc2289d05.jpg,https://imgaz1.chiccdn.com/thumb/view/oaupload/newchic/images/C7/DA/e57c8ffb-6f3a-474c-8399-89cbc2289d05.jpg,https://imgaz1.chiccdn.com/thumb/list_grid/oaupload/newchic/images/45/5A/1f6d1cf5-64e5-4d4b-a24c-1094f2589f29.jpg,https://imgaz1.chiccdn.com/thumb/view/oaupload/newchic/images/45/5A/1f6d1cf5-64e5-4d4b-a24c-1094f2589f29.jpg,https://imgaz1.chiccdn.com/thumb/view/oaupload/newchic/images/F1/4C/6f83ed59-c185-4c4b-aa06-8ad4e0ab7737.jpg,1653834,"Elevate your athletic performance with our exclusive Men's Sport Racing Shoes. Experience the fusion of style and functionality as you conquer your fitness goals. Built for speed and comfort, these shoes are crafted with breathable mesh for superior ventilation, ensuring your feet stay fresh and dry during intense workouts. The non-slip rubber sole provides exceptional traction and stability, allowing you to push your limits without compromise. Be it track races, marathons, or gym workouts, these shoes are your go-to choice for achieving peak performance."
shoes,Moccasins,Menico shoes in laid non -slip leather for men,4828.8,8482.4,43,55,False, Menico,https://fr.newchic.com/-menico-brand-1716.html,Black,Brown,https://imgaz1.chiccdn.com/thumb/list_grid/oaupload/newchic/images/1B/47/7735cb1c-957b-48d7-ab6e-205273a35819.jpg,https://imgaz1.chiccdn.com/thumb/view/oaupload/newchic/images/1B/47/7735cb1c-957b-48d7-ab6e-205273a35819.jpg,https://imgaz1.chiccdn.com/thumb/list_grid/oaupload/newchic/images/B3/B2/e853b85c-8fa9-4beb-a120-24d1cd311ef3.jpg,https://imgaz1.chiccdn.com/thumb/view/oaupload/newchic/images/B3/B2/e853b85c-8fa9-4beb-a120-24d1cd311ef3.jpg,https://imgaz1.chiccdn.com/thumb/view/oaupload/newchic/images/DA/44/96ba1600-d480-41ea-9dd7-e70e2865e441.jpg,1658035,"Are you seeking both style and functionality in your footwear? Look no further than Menico's laid non-slip shoes, crafted with unwavering dedication to elegance and exceptional quality. Our shoes are a perfect choice for the modern man seeking safety and sophistication."
shoes,Derbies and moccasins,Relaxed moccasins with flexible soles,1599.1999999999998,3199.2000000000003,50,4368,False,,,Blue,Gray,https://imgaz1.chiccdn.com/thumb/list_grid/oaupload/newchic/images/2C/68/246fcb9d-71a2-4272-9304-1b77f9a88b0c.jpg,https://imgaz1.chiccdn.com/thumb/view/oaupload/newchic/images/2C/68/246fcb9d-71a2-4272-9304-1b77f9a88b0c.jpg,https://imgaz1.chiccdn.com/thumb/list_grid/oaupload/newchic/images/17/18/7d41d7b0-0983-4d92-b2fe-a17cddeba144.jpg,https://imgaz1.chiccdn.com/thumb/view/oaupload/newchic/images/17/18/7d41d7b0-0983-4d92-b2fe-a17cddeba144.jpg,https://imgaz1.chiccdn.com/thumb/view/oaupload/newchic/images/1E/59/6c2e9fe0-68e1-4aeb-aa8b-9232b6da3ba1.JPG,1034185,"Indulge in the effortless elegance and comfort of our relaxed moccasins designed for the modern man. Craft from premium materials, these moccasins feature flexible soles that adapt to your every step delivering unwavering comfort throughout the day. The sleek design with minimal stitching exudes a timeless charm that pairs effortlessly with any attire, whether you're running errands or attending a casual gathering. Experience the fusion of style and functionality with our relaxed moccasins and enjoy a blissful stride with every step."
shoes,Derbies and moccasins,Retro leather flat shoes,5599.2,11999.2,53,25,False,,,Colored,Nope,https://imgaz1.chiccdn.com/thumb/list_grid/oaupload/newchic/images/D5/06/ede9ff5d-74d4-4d28-8fd0-411aaeecbef1.JPG,https://imgaz1.chiccdn.com/thumb/view/oaupload/newchic/images/D5/06/ede9ff5d-74d4-4d28-8fd0-411aaeecbef1.JPG,,,https://imgaz1.chiccdn.com/thumb/view/oaupload/newchic/images/43/6A/b535fd07-4214-48ea-aa88-87d22373b98b.JPG,1699367,"Relive the charm of the past as you slip into these exquisite retro leather flat shoes. Handcrafted from genuine leather, each pair is meticulously stitched to perfection, ensuring both durability and timeless style. The soft, supple leather conforms to your feet, providing unparalleled comfort with every step. With a versatile design that effortlessly complements any outfit, these shoes are your perfect companion for a leisurely stroll, a night out with friends, or simply adding a touch of vintage elegance to your everyday look."
shoes,Sandals and mules,Square heeled mules,3999.2000000000003,12513.599999999999,68,53,False,Socofy,https://fr.newchic.com/socofy-brand-298.html,Red,Blue,https://imgaz1.chiccdn.com/thumb/list_grid/oaupload/newchic/images/B6/BF/b5d6e6a9-b60b-47ae-8514-35eda3ab72dd.JPG,https://imgaz1.chiccdn.com/thumb/view/oaupload/newchic/images/B6/BF/b5d6e6a9-b60b-47ae-8514-35eda3ab72dd.JPG,https://imgaz1.chiccdn.com/thumb/list_grid/oaupload/newchic/images/01/11/644d7a48-f7bf-4e29-826a-43f034fbf2ac.JPG,https://imgaz1.chiccdn.com/thumb/view/oaupload/newchic/images/01/11/644d7a48-f7bf-4e29-826a-43f034fbf2ac.JPG,https://imgaz1.chiccdn.com/thumb/view/oaupload/newchic/images/01/11/644d7a48-f7bf-4e29-826a-43f034fbf2ac.JPG,1671574,"Elevate your style with our square-heeled mules, the perfect blend of fashion and comfort. Crafted from premium materials, these mules feature a chic square heel and a sleek, minimalistic design that complements any outfit. Whether you're running errands or attending a special event, these mules will keep you looking and feeling your best all day long. Available in a variety of colors to match your personal taste. Step into sophistication with our square-heeled mules and experience the epitome of style and comfort."
